{
  "$schema": "./scripts/project/project.config.schema.json",
  "name": "HS FACOP",
  "tagline": "De puertas abiertas para el mundo",
  "description": "Tu portal al conocimiento y al éxito profesional.",
  "database": {
    "name": "hsfacopdb",
    "user": "facop",
    "port": 5436,
    "container": "hs-facob-db"
  },
  "jwtIssuer": "mi-proyecto",
  "brand": {
    "logo": {
      "light": "/brand/logo-light.svg",
      "dark": "/brand/logo-dark.svg",
      "white": "/brand/logo-white.svg"
    },
    "favicon": "/favicon.svg",
    "colors": {
      "light": {
        "primary": "hsl(297.4 50.8% 35.1%)",
        "ring": "hsl(297.4 50.8% 45%)",
        "brand-start": "hsl(297.4 50.8% 35.1%)",
        "brand-end": "hsl(297.4 50.8% 35.1%)"
      },
      "dark": {
        "primary": "hsl(297 45% 72%)",
        "ring": "hsl(297 45% 72%)",
        "brand-start": "hsl(297.4 50.8% 35.1%)",
        "brand-end": "hsl(297.4 50.8% 35.1%)"
      }
    }
  }
}
